"name","category","description","links"
"Suspicion Agent","General purpose","Playing Imperfect Information Games with Theory of Mind Aware GPT-4 The paper delves into the applicability of GPT-4's learned knowledge for imperfect information games","Main: https://github.com/CR-Gjx/Suspicion-Agent | GitHub: https://github.com/CR-Gjx/Suspicion-Agent | Paper: https://arxiv.org/abs/2309.17277 | Project demo: https://huggingface.co/spaces/cr7-gjx/Suspicion-Agent-Demo | Game data replay: https://huggingface.co/spaces/cr7-gjx/Suspicion-Agent-Data-Visualization"
"SWE Agent","Coding, general purpose","This Devin alternative scores 12.3% on the FULL swe benchmark ""An open source Devin getting 12.29% on 100% of the SWE Bench test set vs Devin's 13.84% on 25% of the test set!"" SWE-agent works by interacting with a specialized terminal, which allows it to: -  Open, scroll and search through files -  Edit specific lines w/ automatic syntax check -  Write and execute tests This custom-built interface is critical for good performance. Simply connecting an LM to a vanilla bash terminal does not work well. ""Our key insight is that LMs require carefully designed agent-computer interfaces (similar to how humans like good UI design). E.g. When the LM messes up indentation, our editor prevents it and gives feedback."" SWE-agent was released by the Princeton NLP team. What makes SWE-agent special is that it performs almost as well as Devin on the SWE-bench. It is important to say that the performance varies based on the model used by the agent. The changes and innovations in SWE-agent compared to Devin are: - The code in SWE Agent is executed locally via Docker. - It uses “Agent-Computer Interface” (ACI) - constraining the interface makes the agent easier to use for LMs. Only a few commants are allowed: run code, look for code, edit code and submit changes to GitHub. Any code the agent writes goes through a syntax check (linter) before being submitted. If the syntax is incorrect, the agent gets feedback and is forced to redo the code. The agent can only read 100 lines of code at a time, rather than the entire file. This makes it easier for the language model to understand the code.","Main: https://github.com/princeton-nlp/SWE-agent | GitHub: https://github.com/princeton-nlp/SWE-agent | Web: https://swe-agent.com/ | Demo: https://swe-agent.com/demo | Discord: https://discord.com/invite/AVEFbBn2rH"
"Sweep","Coding, GitHub","Sweep is a Github assistant the helps fix small bugs and implement small features To install, click the install button Then add the repository you want, make a quick ticket (e.g. writing tests) Prepend the ticket with ""Sweep:"" and let Sweep handle the rest","Main: https://sweep.dev/ | GitHub: https://github.com/sweepai | Discord: https://discord.com/invite/sweep-ai | Interview: Sweep founders share learnings from building an AI coding assistant: https://e2b.dev/blog/sweep-founders-share-learnings-from-building-an-ai-coding-assistant | Tricks for prompting Sweep: https://sweep-ai.notion.site/Tricks-for-prompting-Sweep-3124d090f42e42a6a53618eaa88cdbf1"
"Taxy AI","General purpose, Productivity","Taxy uses GPT-4 to control your browser and perform repetitive actions on your behalf Currently it allows you to define ad-hoc instructions In the future it will also support saved and scheduled workflows Currently in an early stage with a waitlist","Main: https://github.com/TaxyAI/browser-extension | GitHub: https://github.com/TaxyAI/browser-extension | Waitlist: https://docs.google.com/forms/d/e/1FAIpQLScAFKI1fZ1cXhBmSp2HM93Jvuc8Jvrxh5iSbkKhtwKN-OHoTQ/viewform"
"UFO","Multi-agent, GUI Agent","Agent by Microsoft UFO is a UI-Focused dual-agent framework to fulfill user requests on Windows OS by seamlessly navigating and operating within individual or spanning multiple applications.","Main: https://github.com/microsoft/UFO | GitHub: https://github.com/microsoft/UFO | Paper: https://arxiv.org/abs/2402.07939"
"Vanna.AI","Coding, Debugging, Code migration, Data analysis","Vanna is an Open-Source Python-based AI SQL agent trained on your schema that writes complex SQL in seconds AI-driven business intelligence assistant Vanna helps you generate and run accurate SQL for your database using LLMs via Retrieval-Augmented Generation Vanna works in two easy steps - train a RAG ""model"" on your data, and then ask questions which will return SQL queries that can be set up to automatically run on your database The Vanna Python package and the various frontend integrations are all open-source Vanna’s capabilities are tied to the training data you give it. More training data means better accuracy for large and complex datasets Your database contents are never sent to the LLM. The metadata storage layer only sees schemas, documentation, and queries As you use Vanna more, your model continuously improves as we augment your training data","Main: https://vanna.ai/ | Web: https://vanna.ai/ | GitHub: https://github.com/vanna-ai/vanna | Discord: https://discord.com/invite/qUZYKHremx | LinkedIn: https://www.linkedin.com/company/vanna-ai/ | Docs: https://vanna.ai/docs/"
"Web3 GPT","Blockchain, Coding, Generating apps, Smart contract","Write and deploy smart contracts to EVM blockchains. Connect wallet to manually deploy contracts, even from you old chats. Enable Web2/3 users to interact with blockchains without a dedicated web3 wallet using account abstraction and a gas master account. Leverage Chat-GPT to interact with and control Web3-GPT functionalities.","Main: https://w3gpt.ai/ | Web: https://w3gpt.ai/ | GitHub: https://github.com/markeljan/web3gpt?tab=readme-ov-file | Founder's X: https://twitter.com/0xmarkeljan | Founder's LinkedIn: https://www.linkedin.com/in/markeljan/"
"WorkGPT","Coding","WorkGPT is an agent framework in a similar fashion to AutoGPT or LangChain. You give it a directive and an array of APIs and it will converse back and forth with the AI until its directive is complete. For example, a directive could be to research the web for something, to crawl a website, or to order you an Uber. We support any and all APIs that can be represented with an OpenAPI file. WorkGPT now has OpenAI's new function invocation feature baked into it - While chaining together APIs was possible before (see AutoGPT), it was slow, expensive, and error prone - The tweet announcing this feature","Main: https://github.com/team-openpm/workgpt"
"Wren","Coding, Data analysis, Productivity","""WrenAI is an AI-powered data assistant designed to help you retrieve results and insights quickly and effortlessly, without the need for SQL coding. It's also open-source, which means you can customize and use it to suit your specific needs. There are four key principles that we followed when developing WrenAI: 1. Explainability: We made sure that every SQL query generated by WrenAI is accurate, concise, and reliable, so you can trust the results it provides. 2. Interoperability: WrenAI lets you query data from multiple sources, regardless of different data formats and dialects. You can enjoy a standard interface across various sources, saving you time and hassle. 3. Interactive Experience: Our AI-powered assistant engages users in a dialogue, helping to clarify their queries, and refine results in real-time. You can interact with WrenAI in a natural and intuitive way. 4. Continuous Learning: WrenAI continually learns from its interactions with users, feedback, and query history. It incorporates new patterns, information, and data structures into its LLM knowledge base, ensuring that it gets better and more accurate over time.""","Main: https://www.getwren.ai/ | Web: https://www.getwren.ai/ | GitHub: https://github.com/Canner/WrenAI | X (Twitter): https://x.com/getwrenai | Docs: https://docs.getwren.ai/overview/introduction | Blog: https://blog.getwren.ai/"
"XAgent","General purpose, Coding","XAgent is an open-source experimental Large Language Model (LLM) driven autonomous agent that can automatically solve various tasks Emergence & Autonomy: XAgent's autonomous operations transcend biases. Safety & Operation: Secure execution within docker environments. Expert-Knowledge Free: Effective operation without sole expert reliance. Interface & Interaction: Interact via a user-friendly GUI or command line, while it adapts and collaborates. Dual-loop Mechanism: - Outer-Loop: Manages plans and task refinements. - Inner-Loop: Dispatch, ReACT-based execution, feedback. Universal Language - Function Calling: - ToolAgent & ReACT: Optimal action series for subtasks. Tools: -  File Editor -  Python Notebook -  Web Browser -  Shell -  Rapid API","Main: https://github.com/OpenBMB/XAgent | Twitter: https://twitter.com/XAgentTeam | GitHub Repository: https://github.com/OpenBMB/XAgent | Discord: https://discord.gg/zncs5aQkWZ | Youtube Demo: https://www.youtube.com/watch?v=QGkpd-tsFPA"
"yAgents","Coding, Build-your-own","yAgents is an Agent-Builder Agent made by Yeager.ai capable of designing, coding and debugging its own tools. Designed to help build, prototype, and deploy AI-powered tools and agents easily and efficiently. Built on the LangChain framework, allowing users of any technical background to create, improve, and deploy AI agents. Equipped with an interactive command line interface for real-time feedback and ease of navigation. Features session persistent memory to ensure data preservation across multiple sessions Quick and easy installation via pip. Contributions to expand and improve yAgents are highly encouraged. Warnings - Requires GPT-4 API access. - Not tested for Windows systems","Main: https://github.com/yeagerai/yeagerai-agent | GitHub Repository: https://github.com/yeagerai/yeagerai-agent/?utm_source=awesome-ai-agents | Discord: https://discord.com/invite/wKds24jdAX/?utm_source=awesome-ai-agents | License: MIT: https://github.com/yeagerai/yeagerai-agent/blob/main/LICENSE/?utm_source=awesome-ai-agents"
"Yourgoal","General purpose","""This is a Swift port of BabyAGI, an example of an AI-powered task management system that uses OpenAI and Pinecone APIs to create, prioritize, and execute tasks. The main idea behind this system is that it creates tasks based on the result of previous tasks and a predefined objective.""","Main: https://github.com/pj4533/yourgoal/?utm_source=awesome-ai-agents"
"Ability AI","General purpose, Productivity, Business intelligence","Empowering Businesses with Secure, People-Centric Autonomous AI Agents Still in early version","Main: https://ability.ai/ | Web: https://ability.ai/"
"Adept AI","General purpose","A ML research and product lab building general intelligence by enabling humans and computers to work together creatively An AI teammate for everyone ""Adept is building an entirely new way to get things done. It takes your goals, in plain language, and turns them into actions on the software you use every day."" In early stage ""We’re building a machine learning model that can interact with everything on your computer.""","Main: https://www.adept.ai/?utm_source=awesome-ai-agents | Twitter: https://www.adept.ai/?utm_source=awesome-ai-agents | Linkedin: https://www.linkedin.com/company/adeptai/?utm_source=awesome-ai-agents"
"AGENTS.inc","Data analysis, Science, Monitoring, General purpose, Business intelligence, Supports open-source models","AI agents for specific tasks: - Global News Radar AI Agent - Company Identification AI Agent - EU Policy Watch AI Agent - Report AI Agent - Scientific Knowledge Agent - Patent Analysis Agent","Main: https://www.agents.inc/ | Web: https://www.agents.inc/ | X (Twitter): https://x.com/agentsdotinc | LinkedIn: https://www.linkedin.com/company/agentsdotinc/ | YouTube: https://www.youtube.com/c/agentsdotinc | Facebook: https://www.facebook.com/agentsdotinc | GitHub: https://github.com/agentsinc"
"AgentScale","General purpose, Productivity","AgentScale is your very own personal assistant, email writer, calendar scheduler, and internet surfer AgentScale is your very own AI personal assistant","Main: https://agentscale.ai/ | Web: https://agentscale.ai/ | X : https://twitter.com/agentscale | LInkedin: https://www.linkedin.com/company/agentscale-ai/about/"
"Aide by Codestory","Coding","Still in early stage, new features coming soon Now available for JS/TS Can the codebase, identify the root cause, make the fix and auto-generate tests to evaluate whether the bug was resolved","Main: https://codestory.ai/ | Web: https://codestory.ai/ | Docs: https://docs.codestory.ai/ | Discord: https://discord.com/invite/DNnh6tC9VA | X : https://twitter.com/codestoryai | Linkedin: https://www.linkedin.com/company/codestory-ai/"
"AilaFlow","Build-your-own, Productivity","AilaFlow is no-code platform for building AI agents Use a template, adjust it using no-code editor to your needs Category: Productivity, Framework for building agents","Main: https://ailaflow.com | AilaFlow - AI Agents No-code Platform: https://ailaflow.com"
"Airkit.ai","Build-your-own","A browser based studio for managing prompts, building tools, and testing your agents. Built in short-term and long-term memory management 1 click deployment. Embed anywhere with our Web SDK.","Main: https://www.airkit.ai | Profile of the company: https://www.airkit.ai | Twitter: https://twitter.com/AirkitAI"
"Airplane Autopilot","Coding, General purpose","A developer-centric approach to building internal UIs and workflows Turning APIs, SQL queries, and scripts into apps for the entire team Features - Airplane lets you turn SQL queries, JavaScript/Python code, HTTP requests, etc into tasks - Allows to run tasks through a no-code dashboard - Tasks for customer support, on-call runbooks, and scheduled tasks","Main: https://www.airplane.dev/autopilot/?utm_source=awesome-ai-agents/ | Profile of the company: https://www.airplane.dev/?utm_source=awesome-ai-agents | Documentation: https://docs.airplane.dev/?utm_source=awesome-ai-agents | Twitter: https://twitter.com/AirplaneDev/?utm_source=awesome-ai-agents | They're building an AI assistant here: https://www.airplane.dev/autopilot/?utm_source=awesome-ai-agents"
"Aomni","Business intelligence","Breaks down a high level research question into a step-by-step plan, and executes it Diverse tools, including a full web browser Can access internet information without the need for an API ""We don't generate content using AI, as it can be unreliable. Instead, we extract relevant information from trusted sources, cluster and process it into a user-friendly format."" AI-powered query planner intelligently routes and executes requests, ensuring correctness and diverse source selection","Main: https://www.aomni.com/?utm_source=awesome-ai-agents | Discord: https://discord.com/invite/a367ncqEsm/?utm_source=awesome-ai-agents | Interview: David Zhang from Aomni gives his view agents' reliability, debugging and orchestration: https://e2b.dev/blog/david-zhang-from-aomni-gives-his-view-on-ai-agents"
"Artisian AI","Multi-agent, Build-your-own","YC company ""Creating the first human-like digital workers, called Artisans"" Artisans are advanced human-like digital workers trained to do specific roles, who integrate alongside human teams They have unique faces, names, memories & skills, and they continuously improve once they are employed, molding to each company's needs The first Artisan, Ava, automates the entire outbound sales process and can be set up with a 10-minute conversation. Ava creates TCPs, prospects with her database of over 270,000,000 contacts, crafts & sends highly bespoke email sequences, and books meetings into your calendar. And, you can manage all features & settings by talking to Ava via Slack.","Main: https://github.com/Artisan-AI | GitHub: https://github.com/Artisan-AI | X : https://twitter.com/GetArtisanAI | LinkedIn: https://www.linkedin.com/company/artisanai/ | Founder's X: https://twitter.com/jasparcjack | Founder's LinkedIn: https://www.linkedin.com/in/rupertdodkins/ | Article: https://tech.eu/2023/11/17/ai-startup-artisan-raises-23m-to-develop-human-like-digital-workers/"
"Ask Pandi","Productivity, Research, General purpose","Pandi compiles your search's final stretch into a concise, distraction-free webpage. It offers multi-modal answers with citations from top web creators, eliminating the need for link sifting, cookie consents, or ads. You can use the internet as a data source, create your own library, or do both. You can also use Pandi in creative mode for writing or coding.","Main: https://askpandi.com/ask | Web: https://askpandi.com/ask | X (Twitter): https://twitter.com/ask_pandi"
"AskToSell","Sales, Build-your-own, Business intelligence, Marketing","A web platform to deploy & manage autonomous AI sales agents that close small deals. Autonomous agents will contact your leads, qualify, prepare offers, handle objections, negotiate, and close the deal with superhuman-like performance AskToSell autonomously moves your leads through the pipeline. AI Sales Agents will learn about your product, contact your leads, qualify, prepare proposals, handle objections, negotiate, and close the deals.","Main: https://asktosell.com/ | Web: https://asktosell.com/ | LinkedIn: https://www.linkedin.com/company/asktosell/ | Founder's LinkedIn - Laimonas Noreika: https://www.linkedin.com/in/laimonasn/"
"AskYourDatabase","Business intelligence, Productivity, Data analysis","""ChatGPT for SQL"" No SQL, Connect your database and chat with your data in ChatGPT","Main: https://www.askyourdatabase.com/ | Web: https://www.askyourdatabase.com/ | Discord: https://discord.com/invite/AZ2WnRxTD8 | Founder's LinkedIn: https://www.linkedin.com/in/sheldon-niu-a174bb243/"
"Athena Intelligence","Data analysis, Business intelligence","Athena is an AI-native analytics platform designed to accelerate analytics workflows for enterprise teams. It offers both co-pilot and auto-pilot modes, learning users' workflows to allow for autonomous execution with confidence. Athena supports querying data, generating visualizations, analyzing enterprise data, and codifying workflows, making it a powerful tool for data-driven decision-making.","Main: https://www.athenaintelligence.ai/ | Web: https://www.athenaintelligence.ai/ | Founder's LinkedIn: https://www.linkedin.com/in/brendongeils/"
"Avanzai","Coding, Data analysis, Research, Build-your-own (agent-builing frameworks and platforms), Finance, Multi-agent","Avanzai helps users build autonomous AI agents that scrape news, fetch real time data and write Python code that helps them calculate risk exposures of their portfolio. Users can then deploy these agents to work around the clock, saving users time from doing this themselves.","Main: https://avanz.ai/ | Web: https://avanz.ai/ | Founder's X (Twitter): https://x.com/gmanmalena_ | LinkedIn: https://www.linkedin.com/company/avanzai/"
"Bardeen","Productivity, Sales","AI Agent for automating repetitive tasks","Main: https://www.bardeen.ai/ | Web: https://www.bardeen.ai/ | X (Twitter): https://x.com/bardeenai"
"Beam","Data analysis, Productivity, Build-your-own (agent-builing frameworks and platforms), Business intelligence, Multi-agent","End-to-end process and workflow automation with intelligent AI agents. With multiple B2B2C use-cases among a myriad of industries - healthcare, insurance, logistics, customer service, etc. - Beam allows businesses to customise their own automations or choose from existing agent templates to minimize the time it takes to execute complex tasks, repetitive tasks, and 100% of back office tasks.","Main: https://beam.ai/ | Web: https://beam.ai/ | X (Twitter): https://x.com/join__beam | LinkedIn: https://www.linkedin.com/company/beam-ai/ | YouTube: https://www.youtube.com/@beam-ai"
"Blackbox AI","- General purpose, coding, data analysis","BLACKBOX.AI is a coding LLM designed to transform the way we build software. By building BLACKBOX.AI, our goal is to: 1. Accelerate the pace of innovation within companies by making engineers 10X faster in building and releasing products 2. Accelerate the growth in software engineers around the world and 10X the number of engineers from ~100M to 1B","Main: https://www.blackbox.ai/ | Web: https://www.blackbox.ai/ | Blackbox AI Code Interpreter: https://www.runcode.ai/ | Blackbox AI Code Interpreter in terminal: https://pypi.org/project/blackboxai/ | X (Twitter): https://x.com/aiblckbx?lang=cs | Facebook: https://www.facebook.com/blckbxai/ | Chrome extension: https://chromewebstore.google.com/detail/mcgbeeipkmelnpldkobichboakdfaeon | BLACKBOX AI vs Codium AI: https://medium.com/@blackbox.ai/blackbox-ai-vs-codium-ai-7016abb93ec0 | Blackbox AI: Supercharging Your Coding Workflow: https://www.linkedin.com/pulse/blackbox-ai-supercharging-your-coding-workflow-swarup-mukharjee-5gqbe/ | Unveiling the Untold Story of Blackbox.ai: A Revolution in Software Quality Assurance: https://www.linkedin.com/pulse/unveiling-untold-story-blackboxai-revolution-software-yaqoot-kashif-em75f/"
"Blobr","Data analysis, Productivity, Marketig, Sales, Business intelligence","Blobr is an AI assistant making sense of your business data stored in all your siloed SaaS. Reveal insights, understand variations and customer patterns without technical effort. Blobr helps Sales Ops, Marketing Ops and growth people to make better decisions. Blobr adds an intelligence layer connected to all your SaaS (Hubspot, Google Analytics, Stripe, etc.).","Main: https://www.blobr.io/ | Web: https://www.blobr.io/ | X (Twitter): https://twitter.com/Blobr_io | Founder's LinkedIn: https://www.linkedin.com/in/alexandre-airvault-aabaa758/"
"BrainSoup","General purpose, Productivity, Data analysis, Multi-agent, Build-your-own","Custom AI agents that remember, learn and work together. Local native app, for privacy and responsiveness. Your data fuels your AI agents without leaving your PC. Multimodal: your AI agents understand text, voice, and images. Reactive: your agents can respond to user defined events and leverage real-time data. Autonomous: your agents can run in the background without user intervention. Collaborate safely: AIs can read, write execute and share files in a sandboxed environment. Multi-LLM: local and cloud-based AI models can be combined for best of both worlds. Tinkerable & extensible: empower your agents with custom tools and scripts.","Main: https://www.nurgo-software.com/products/brainsoup | Web: https://www.nurgo-software.com/products/brainsoup | Docs: https://help.nurgo-software.com/collection/148-brainsoup | X: https://twitter.com/Nurgo | Discord: https://discord.gg/xt7PyCnH9S"
"broadn","Coding","broadn is a no-code platform that helps non-technical people build AI products in minutes. We're faster and more flexible than traditional no-code tools through an LLM powered conversational interface and an agent architecture that automates complex backend/workflow operations Features - Conversational interface - LLM/AI model connectors (text, image models, etc) - Create bespoke chatbots - Render UI components - Connect to external data via APIs","Main: https://www.broadn.io/?utm_source=awesome-ai-agents | Twitter: https://twitter.com/getbroadn"
"Butternut AI","Web design, Design, Coding, Marketing","A tool for creating a fully-functioning, ready-to-launch website in 20 seconds No coding required thanks to user-friendly interface Full SEO optimization Picture Upload: Users can conveniently upload and regenerate their own pictures for unlimited customization of their profiles Profile Customization: Users have the flexibility to customize their profiles by hiding sections, adding social media links, and sharing contact details, allowing them to showcase their unique personality and brand Instant Preview: Users can instantly visualize their profile changes through a conveniently placed preview button, ensuring a quick assessment of the desired appearance 30% Faster Speed: The app achieves an impressive 30% increase in website generation speed, providing users with a fast and efficient website building experience.","Main: https://butternut.ai/ | Web: https://butternut.ai/"
"B2 AI","Personal assistant, Business intelligence, Productivity, Data analysis","B2 is an autonomous AI assistant to help you get things done Share useful workflows with your team members or schedule AI-powered recurring workflows. Granular data-controls so your company's data doesn't end up in the wrong hands. Fully configurable role-based access.","Main: https://www.b2.work/ | Web: https://www.b2.work/ | Founder's X - Ethan: https://twitter.com/amazng_wanderer"
"ChatHelp","Data analysis, Content creation, Productivity, Research, Marketig, Sales, Business intelligence","Chat with Private AI Knowledge Base - Increase daily work efficiency, by having an AI assistant, who knows everything about your business & competitors, your work or studies...  Save time & money on customer support. Drive more sales, by letting AI interact with potential customers 24/7, via Website Chat Widget. Train AI with your Website data & other documentation!  100+ Unique AI Tools, for all your Business, Work & Study needs. Like, AI Writing Assistant & WordPress Auto Poster.  Understand your customers better with AI-powered Feedback, Voting & Survey Widgets!  Supported file formats: pdf, doc, docx, ppt, pptx, xls, xlsx, csv, json, epub, mp3, jpg, jpeg, png  WordPress Plugin  Youtube Transcripts  Analyze Yelp Reviews  +175 Languages  Create an AI-powered Website Chat Widget.  Create a Custom AI-powered Knowledge Base  Zapier, Notion, ZenDesk, Hubspot, Trello, Monday.com, Slack, Gmail & Google Doc. support.""","Main: https://chathelp.ai/ | Web: https://chathelp.ai/ | X (Twitter): https://twitter.com/ChatHelpAI | LinkedIn: https://www.linkedin.com/company/chathelp/about/ | Discord: https://discord.com/invite/BK5QtfKxbB | Facebook: https://www.facebook.com/ChatHelpAI | GitHub: https://github.com/chathelpai"
