"name","category","description","links"
"Adala","General purpose, Build your own, Multi-agent","Reliable agents: Built on ground truth data for consistent, trustworthy results. Controllable output: Tailor output with flexible constraints to fit your needs. Specialized in data processing: Agents excel in custom data labeling and processing tasks. Autonomous learning: Agents evolve through observations and reflections, not just automation. Flexible and extensible runtime: Adaptable framework with community-driven evolution for diverse needs. Easily customizable: Develop agents swiftly for unique challenges, no steep learning curve.","Main: https://github.com/HumanSignal/Adala | Documentation: https://humansignal.github.io/Adala/ | Discord: https://discord.gg/QBtgTbXTgU | GitHub: https://github.com/HumanSignal/Adala"
"Agent4Rec","General purpose, Build your own, Multi-agent","Agent4Rec is a recommender system simulator that utilizes 1,000 LLM-empowered generative agents. These agents are initialized from the MovieLens-1M dataset, embodying varied social traits and preferences. Each agent interacts with personalized movie recommendations in a page-by-page manner and undertakes various actions such as watching, rating, evaluating, exiting, and interviewing.","Main: https://github.com/LehengTHU/Agent4Rec | Paper: https://arxiv.org/abs/2310.10108"
"AgentForge","General purpose, Build your own, Multi-agent","A low-code framework designed for the swift creation, testing, and iteration of AI-powered autonomous agents and Cognitive Architectures, compatible with various LLM models. Facilitates building custom agents and cognitive architectures with ease. Supports multiple LLM models including OpenAI, Anthropic's Claude, and local Oobabooga, allowing flexibility in running different models for different agents based on specific requirements. Provides customizable agent memory management and on-the-fly prompt editing for rapid development and testing. Comes with a database-agnostic design ensuring seamless extensibility, with straightforward integration with different databases like ChromaDB for various AI projects.","Main: https://github.com/DataBassGit/AgentForge | GitHub: https://github.com/DataBassGit/AgentForge | Web: https://www.agentforge.net/ | Discord: https://discord.com/invite/ttpXHUtCW6 | X: https://twitter.com/AgentForge"
"AI Legion","Multi-agent, Build-your-own","An LLM-powered autonomous agent platform A framework for autonomous agents who can work together to accomplish tasks Interaction with agents done via console direct messages","Main: https://github.com/eumemic/ai-legion | Website: https://gpt3demo.com/apps/ai-legion | GitHub: https://github.com/eumemic/ai-legion | Twitter: https://twitter.com/dysmemic"
"Aider","Coding, GitHub","Aider is a command line tool that lets you pair program with GPT-3.5/GPT-4, to edit code stored in your local git repository You can start a new project or work with an existing repo. And you can fluidly switch back and forth between the aider chat where you ask GPT to edit the code and your own editor to make changes yourself Aider makes sure edits from you and GPT are committed to git with sensible commit messages. Aider is unique in that it works well with pre-existing, larger codebases","Main: https://github.com/paul-gauthier/aider"
"AutoGPT","General purpose","An experimental open-source attempt to make GPT-4 fully autonomous, with >140k stars on GitHub Chains together LLM ""thoughts"", to autonomously achieve whatever goal you set Internet access for searches and information gathering Long-term and short-term memory management Can execute many commands such as Google Search, browse websites, write to files, and execute Python files and much more GPT-4 instances for text generation Access to popular websites and platforms File storage and summarization with GPT-3.5 Extensibility with Plugins ""A lot like BabyAGI combined with LangChain tools"" Features added in release 0.4.0 - File reading - Commands customization - Enhanced testing","Main: https://agpt.co/?utm_source=awesome-ai-agents | Twitter: https://twitter.com/Auto_GPT/?utm_source=awesome-ai-agents | GitHub: https://github.com/Significant-Gravitas/Auto-GPT/?utm_source=awesome-ai-agents | Facebook: https://www.facebook.com/groups/1330282574368178/?utm_source=awesome-ai-agents | Linkedin: https://www.linkedin.com/company/autogpt/?utm_source=awesome-ai-agents | Discord: https://discord.gg/autogpt/?utm_source=awesome-ai-agents"
"Automata","Coding","Model: GPT 4 Automata takes your project as a context, receives tasks, and executes the instructions seamlessly. Features - Automata aims to evolve into a fully autonomous, self-programming Artificial Intelligence system. - It's designed for seamless integration with all available agent platforms and LLM providers. - Utilizes the novel code search algorithm, SymbolRank, and associated tools to build superior coding intelligence. - Modular, fully configurable design with minimal reliance on external dependencies","Main: https://github.com/emrgnt-cmplxty/automata | GitHub: https://github.com/emrgnt-cmplxty/automata | Docs: https://automata.readthedocs.io/en/latest/"
"AutoPR","Coding, GitHub","Triggered by adding a label containing AutoPR to an issue, AutoPR will: - Plan a fix - Write the code - Push a branch - Open a pull request","Main: https://github.com/irgolic/AutoPR | Discord: https://discord.com/invite/ykk7Znt3K6"
"Autonomous HR Chatbot","HR, Business intelligence, Productivity","A prototype enterprise application - an Autonomous HR Assistant powered by GPT-3.5. An agent that can answer HR related queries autonomously using the tools it has on hand. Powered by GPT-3.5 Current tools assigned to the agent (with more on the way): - Timekeeping Policy - Employee Data - Calculator","Main: https://github.com/stepanogil/autonomous-hr-chatbot | GitHub: https://github.com/stepanogil/autonomous-hr-chatbot | YouTube demo: https://www.youtube.com/watch?v=id7XRcEIBvg&ab_channel=StephenBonifacio | Blog post: https://pub.towardsai.net/creating-a-mostly-autonomous-hr-assistant-with-chatgpt-and-langchains-agents-and-tools-1cdda0aa70ef"
"BabyBeeAGI","General purpose, Productivity","A more advanced version of the original BabyAGI code Improves upon the original framework, by introducing a more complex task management prompt, allowing for more comprehensive analysis and synthesis of information Designed to handle multiple functions within one task management prompt Built on top of the GPT-4 architecture, resulting in slower processing speeds and occasional errors Provides a framework that can be further built upon and improved, paving the way for more sophisticated AI applications One of the significant differences between BabyAGI and BabyBeeAGI is the complexity of the task management prompt","Main: https://yoheinakajima.com/babybeeagi-task-management-and-functionality-expansion-on-top-of-babyagi/ | Tweet: https://twitter.com/yoheinakajima/status/1652732735344246784 | GitHub: https://github.com/yoheinakajima/babyagi/blob/main/classic/BabyBeeAGI.py | Replit: https://replit.com/@YoheiNakajima/BabyBeeAGI?v=1"
"BabyDeerAGI","General purpose","Features - Parallel tasks (making it faster) - 3.5-turbo only (GPT-4 not required) - User input tool - Query rewrite in web search tool - Saves results","Main: https://twitter.com/yoheinakajima/status/1666313838868992001 | Tweet: https://twitter.com/yoheinakajima/status/1666313838868992001 | GitHub: https://github.com/yoheinakajima/babyagi/blob/main/classic/BabyDeerAGI.py | Replit: https://replit.com/@YoheiNakajima/BabyDeerAGI"
"BambooAI","Data analysis","BambooAI runs in a loop (until user decides to end it). Allows mixing of different models with different capabilities, token costs and context windows for different tasks. Maintains the memory of previous conversations. Builds the prompts dynamically utilising relevant context from Pinecone vector DB. Offers a narrative or asks follow up questions if required. For codified responses, the task is broken down into a list of steps and a pseudo-code algorithm is built. Based on the algorithm, it ises the python code for dataset analysis, modeling or plotting. Debugs the code which then executes, auto-corrects if needs to, and displays the output to user. Ranks the final answers, and asks user for feedback. Builds a vector DB knowledge-base, based on the rank and the user feedback.","Main: https://github.com/pgalko/BambooAI | GitHub: https://github.com/pgalko/BambooAI | Creators's Twitter: https://twitter.com/pgalko"
"BeeBot","General purpose, Productivity","""BeeBot is currently a work in progress and should be treated as an early stage research project. Its focus is not on production usage at this time.""","Main: https://github.com/AutoPackAI/beebot | GitHub: https://github.com/AutoPackAI/beebot | Tweet: https://twitter.com/Douglas_Schon/status/1681094815021187072?s=20"
"Blinky","Coding, Debugging","Blinky is an open-source AI debugging agent for VSCode that uses LLMs to help identify and fix backend code errors (inspired by SWE-agent). Blinky leverages the VSCode API, Language Server Protocol (LSP), and print statement debugging to triangulate and address bugs in real-world backend systems.","Main: https://github.com/seahyinghang8/blinky | VSCode Extension: https://marketplace.visualstudio.com/items?itemName=blinky.blinky | Discord: https://discord.gg/d3AUNHDb | GitHub: https://github.com/seahyinghang8/blinky"
"Bloop","Coding","A GPT-4 powered semantic code search engine that uses an AI agent Precise code navigation Built on stack graphs and scope queries Fast code search and regex matching engine written in Rust Allows to find Code on Rust and Typescript Allows to stage changes The agent searches both your local and remote repositories with natural language, regex and filtered queries Bloop can be run via app (easy to download via GitHub)","Main: https://bloop.ai/ | GitHub: https://github.com/BloopAI/bloop | ""Getting started"" guide: https://bloop.ai/docs/getting-started | Bloop apps: https://github.com/BloopAI/bloop/releases"
"BondAI","Coding","A highly capable, autonomous AI Agent with an easy to use CLI, RESTful/WebSocket API, Pre-built Docker image and a robust suite of integrated tools. Support for all GPT-N, Embeddings and Dall-E OpenAI Models Support for Azure OpenAI Services Easy to use SDK for integration into any application Powerful Code Interpreter capabilities Powerful data query capabilities via Postgres DB integration Pre-built Docker image provides safe execution environment for code generation/execution Support for telephony applications (via BlandAI) Support for stock trading (via Alpaca Markets) Integrates with Gmail and Google Search Easy to install `pip install bondai` To start the CLI just run `bondai` To start the RESTful/WebSocket API just run `bondai --server`","Main: https://bondai.dev/ | BondAI Homepage/Documentation: https://bondai.dev | Github Repository: https://github.com/krohling/bondai | Docker Image: https://hub.docker.com/r/krohling/bondai"
"bumpgen","Coding","Put dependency management and upgrades on autopilot bumpgen BUMPs an npm package's version up then GENerates the code fixes for breaking changes Supports gpt-4-turbo Easy install > `npm install -g bumpgen` Easy start > `bumpgen @tanstack/react-query 5.28.14`","Main: https://github.com/xeol-io/bumpgen | Repo: https://github.com/xeol-io/bumpgen | Docs: https://docs.xeol.io/bumpgen/home"
"Cal.ai","Productivity","Cal.ai can book meetings, summarize your week, and find time with others based on natural language. Responds flexibly to unseen tasks eg. ""move my second-last meeting to tomorrow morning"". Uses GPT-4 and LangChain Agent Executor under the hood. GitHub","Main: https://cal.ai"
"CAMEL","General purpose","CAMEL is an open-source library designed for the study of autonomous and communicative agents. 1)AI user agent: give instructions to the AI assistant with the goal of completing the task. 2) AI assistant agent: follow AI user’s instructions and respond with solutions to the task CAMEL also has an open-source community dedicated to the study of autonomous and communicative agents","Main: https://github.com/camel-ai/camel | Web: https://www.camel-ai.org/ | Paper - CAMEL: Communicative Agents for “Mind Exploration of Large Scale Language Model Society: https://ghli.org/camel.pdf | Colab demo: https://colab.research.google.com/drive/1AzP33O8rnMW__7ocWJhVBXjKziJXPtim?usp=sharing | GitHub: https://github.com/camel-ai/camel | Hugging face datasets: https://huggingface.co/camel-ai | Slack: https://camel-kwr1314.slack.com/join/shared_invite/zt-1vy8u9lbo-ZQmhIAyWSEfSwLCl2r2eKA#/shared-invite/email | Twitter: https://twitter.com/intent/follow?original_referer=https%3A%2F%2F1508613885-atari-embeds.googleusercontent.com%2F&ref_src=twsrc%5Etfw%7Ctwcamp%5Ebuttonembed%7Ctwterm%5Efollow%7Ctwgr%5ECamelAIOrg&screen_name=CamelAIOrg"
"ChatArena","Design, Build-your-own, SDK for AI apps, Multi-agent","ChatArena (or Chat Arena) is a Multi-Agent Language Game Environments for LLMs. The goal is to develop communication and collaboration capabilities of AIs. ChatArena provides: A general framework for building interactive environments for multiple large language models (LLMs). A collection of pre-built or community-created environments. User-friendly interfaces with both Web UI and commandline interfaces.","Main: https://www.chatarena.org/ | Web: https://www.chatarena.org/ | GitHub: https://github.com/Farama-Foundation/chatarena | X: https://twitter.com/_chatarena | Slack channel: https://chatarena.slack.com/join/shared_invite/zt-1t5fpbiep-CbKucEHdJ5YeDLEpKWxDOg#/shared-invite/email"
"ChatDev","Coding, Multi-agent","ChatDev is a virtual software company driven by a multitude of intelligent agents assuming different roles such as CEO, CPO, CTO, programmer, reviewer, tester, and art designer, each represented by unique icons. These agents collaborate in a structured organizational environment, fulfilling the company's mission to ""revolutionize the digital world through programming."" They engage in functional seminars focusing on design, coding, testing, and documentation. ChatDev aims to provide an accessible, modular, and extensible platform based on large language models, facilitating the study of collective intelligence in a controlled setting. The framework allows for extensive customization, empowering users to tailor the software development process, define phases, and establish specific roles within the virtual company. ChatDev is committed to open-source principles, encouraging contributions from the community and sharing advancements transparently.","Main: https://github.com/OpenBMB/ChatDev | Paper - ChatDev: Communicative Agents for Software Development: https://arxiv.org/abs/2307.07924 | Local demo: https://github.com/OpenBMB/ChatDev/blob/main/wiki.md#local-demo | GitHub: https://github.com/OpenBMB/ChatDev"
"ChemCrow","Science, Chemistry","ChemCrow is an open source package for the accurate solution of reasoning-intensive chemical tasks It integrates 13 expert-design tools to augment LLM performance in chemistry and demonstrate effectiveness in automating chemical tasks Built with Langchain The LLM is provided with a list of tool names, descriptions of their utility, and details about the expected input/output. It is then instructed to answer a user-given prompt using the tools provided when necessary. The instruction suggests the model to follow the ReAct format - Thought, Action, Action Input, Observation. One interesting observation is that while the LLM-based evaluation concluded that GPT-4 and ChemCrow perform nearly equivalently, human evaluations with experts oriented towards the completion and chemical correctness of the solutions showed that ChemCrow outperforms GPT-4 by a large margin. This indicates a potential problem with using LLM to evaluate its own performance on domains that requires deep expertise. The lack of expertise may cause LLMs not knowing its flaws and thus cannot well judge the correctness of task results. (Source: Weng, Lilian. (Jun 2023). LLM-powered Autonomous Agents"". Lil’Log. https://lilianweng.github.io/posts/2023-06-23-agent/.)","Main: https://github.com/ur-whitelab/chemcrow-public | Paper: https://arxiv.org/abs/2304.05376 | GitHub: https://github.com/ur-whitelab/chemcrow-public | HackerNews Discussion: https://news.ycombinator.com/item?id=35607616"
"Clippy","Coding","The purpose of Clippy is to elop code for or with the user. It can plan, write, debug, and test some projects autonomously. For harder tasks, the best way to use it is to look at its work and provide feedback to it.","Main: https://github.com/ennucore/clippy/ | GitHub: https://github.com/ennucore/clippy/"
"Cody by ajhous44","Coding","An AI assistant designed to let you interactively query your codebase using natural language. By utilizing vector embeddings, chunking, and OpenAI's language models, Cody can help you navigate through your code in an efficient and intuitive manner.","Main: https://github.com/ajhous44/cody | GitHub: https://github.com/ajhous44/cody"
"Cody by Sourcegraph","Coding","An AI code assistant from Sourcegraph that writes code and answers questions for you by reading your entire codebase and the code graph.","Main: https://docs.sourcegraph.com/cody | GitHub: https://github.com/sourcegraph/sourcegraph/tree/main/client/cody"
"Continue","Coding","An open-source autopilot for software development—bring the power of ChatGPT to VS Code Features: - Answer coding questions - Edit in natural language - Generate files from scratch","Main: https://continue.dev/ | Website: https://continue.dev/ | GitHub: https://github.com/continuedev/continue | Documentation: https://continue.dev/docs/intro | Twitter: https://twitter.com/continuedev"
"Databerry","Build-your-own","A super-easy no-code platform for creating AI chatbots trained on your own data After creating new agent, picking a model, data and other settings, they are ready to be deployed to website, Slack, Crisp, or Zapier Limit of agent in the free version Stack - Next.js - Joy UI - LangchainJS - PostgreSQL - Prisma - Qdrant Features - Streamline customer support, onboard new team members, and more - Load data from anywhere - No-code: User-friendly interface to manage your datastores and chat with your data - Secured API endpoint for querying your data - Auto sync data sources (coming soon) - Auto generates a ChatGPT Plugin for each datastore","Main: https://www.databerry.ai/ | Documentation: https://docs.chaindesk.ai/introduction | Discord: https://discord.com/invite/FSWKj49ckX | GitHub: https://github.com/gmpetrov/databerry"
"DemoGPT","Build-your-own, General purpose","DemoGPT leverages the power of Language Models (LLMs) to provide fast and effective demo creation for applications. Automates the prototyping process, making it more efficient and saving valuable time. Understands and processes the given prompts to generate relevant applications. Integrated with LangChain for generating application code through iterative parsing of LangChain's documentation with a ""Tree of Transformations"" (ToT) approach. The roadmap for DemoGPT includes constant updates and improvements based on user feedback and real-world application, working towards refining the technology and solving the hallucination problem. ""We are planning to introduce features that will further enhance the application generation process, making it more user-friendly and efficient.""","Main: https://github.com/melih-unsal/DemoGPT | Github: https://github.com/melih-unsal/DemoGPT | Website: https://www.demogpt.io/ | Twitter: https://twitter.com/demo_gpt | Streamlit App: https://demogpt.streamlit.app/ | Hugging Face Space: https://huggingface.co/spaces/melihunsal/demogpt"
"DevGPT","Coding, Multi-agent","""Tell your AI team what microservice you want to build, and they will do it for you. Your imagination is the limit!! Welcome to Dev-GPT, where we bring your ideas to life with the power of advanced artificial intelligence! Our automated development team is designed to create microservices tailored to your specific needs, making your software development process seamless and efficient. Comprised of a virtual Product Manager, Developer, and DevOps, our AI team ensures that every aspect of your project is covered, from concept to deployment.","Main: https://github.com/jina-ai/dev-gpt | Discord: https://discord.com/invite/AWXCCC6G2P"
"Devika","Coding, general purpose","Devika is an Agentic AI Software Engineer that can understand high-level human instructions, break them down into steps, research relevant information, and write code to achieve the given objective. Devika aims to be a competitive open-source alternative to Devin by Cognition AI.","Main: https://github.com/stitionai/devika | GitHub: https://github.com/stitionai/devika"
"Devon","Coding, general purpose","Open-source alternative to Devin by Entropy research","Main: https://github.com/entropy-research/Devon | GitHub: https://github.com/entropy-research/Devon"
"DevOpsGPT","Coding","Welcome to the AI Driven Software Development Automation Solution, abbreviated as DevOpsGPT. We combine LLM (Large Language Model) with DevOps tools to convert natural language requirements into working software. This innovative feature greatly improves development efficiency, shortens development cycles, and reduces communication costs, resulting in higher-quality software delivery.","Main: https://github.com/kuafuai/DevOpsGPT | Creator Website: https://www.kuafuai.net/ | Demo Video: https://youtu.be/IWUPbGrJQOU"
"dotagent","Build-your-own","An agent management system that facilitates the creation of robust AI applications and experimental autonomous agents through a rich suite of developer tools. Enables the deployment of agents across multiple platforms including cloud, PCs, or mobile devices, and extends functionality through Python or plain English integrations. Advances prompt engineering with a powerful prompt compiler, offering a higher degree of control over Language Models, significantly optimizing the response generation process. Allows seamless export of agents into portable files for execution in any environment, along with an optional Agentbox feature for optimized computing resource management within a sandboxed environment.","Main: https://github.com/dot-agent/dotagent | YouTube video: https://www.youtube.com/watch?v=uE_fykl8AVI&ab_channel=FahdMirza"
"Eidolon","Build-your-own (agent-builing frameworks and platforms), SDK for AI apps","Eidolon is an open source SDK for AI agents","Main: https://eidolonai.com/ | Web: https://eidolonai.com/ | GitHub: https://github.com/eidolon-ai/eidolon | LinkedIn: https://www.linkedin.com/company/august-data/ | Dave Brewster - LinkedIn: https://www.linkedin.com/in/dave-brewster-first/ | Ravi Ramachandran - LinkedIn: https://www.linkedin.com/in/ravi-nextlevelgtm/ | Luke Lalor - LinkedIn: https://www.linkedin.com/in/lukehlalor/"
"English Compiler","Coding","OC AI based Compiler, for converting english based markdown specs, into functional code ""We know that all great™ projects start with awesome™ detailed functional specifications. Which is typically written in English, or its many other spoken language alternatives. So what if, instead of writing code from functional specs, we simply compile it directly to code? Into a future, where we replace nearly everything, with just written text.""","Main: https://github.com/uilicious/english-compiler | Creator's Twitter: https://twitter.com/picocreator"
"evo.ninja","General purpose, Research, Multi-agent","What makes evo.ninja special is that it adapts itself in real-time, based on the tasks at hand. Evo utilizes pre-defined agent personas that are tailored to specific domains of tasks. Each iteration of evo's execution loop it will select and adopt the persona that fits the task at hand best.","Main: https://evo.ninja/ | Web: https://evo.ninja/ | GitHub: https://github.com/polywrap/evo.ninja/ | Discord: https://discord.com/invite/r3rwh69cCa"
"FastAgency","Build-your-own (agent-builing frameworks and platforms), SDK for AI apps, Multi-agent, Supports open-source models","""FastAgency is an open-source framework designed to accelerate the transition from prototype to production for multi-agent AI workflows. For developers who use the AutoGen framework, FastAgency enables you to seamlessly scale Jupyter notebook prototypes into fully functional, production-ready applications. With multi-framework support, a unified programming interface, and powerful API integration capabilities, FastAgency streamlines the deployment process, saving time and effort while maintaining flexibility and performance.","Main: https://fastagency.ai/latest/ | Web: https://fastagency.ai/latest/ | GitHub: https://github.com/airtai/fastagency"
"Flowise","Build-your-own (agent-builing frameworks and platforms)","Flowise is an open source low-code tool for developers to build customized LLM orchestration flow & AI agents","Main: https://flowiseai.com/ | Web: https://flowiseai.com/ | GitHub: https://github.com/FlowiseAI/Flowise | X (Twitter): https://x.com/FlowiseAI | LinkedIn: https://www.linkedin.com/company/flowiseai/"
"Friday","Coding","A developer assistant able to make whole nodejs project with unlimited prompts Provides a core prompt for building the foundation of your application Allows you to add unlimited sections, each of which is a prompt representing a specific part of your app Features - Friday utilizes GPT-4 for AI assistance, but it has been tested and optimized with GPT-4-32k for improved speed and better results. - It requires 2 small requests for your app's base and 1 request per section you provide. - Friday employs esbuild behind the scenes for every app created by it.","Main: https://github.com/amirrezasalimi/friday/"
