"name","category","description","links"
"Claygent","Productivity, Marketig, Sales, Finance, General purpose, Business intelligence","Claygent is an AI web scraper that can search and browse the web to find information for you and replace a huge amount of the manual work your SDRs are doing on account research!","Main: https://www.clay.com/learn/claygent | Web: https://www.clay.com/learn/claygent | Founder's LinkedIn: https://www.linkedin.com/in/adam-eldefrawy-8623a815a/"
"Code Autopilot","Coding, Multi-agent, GitHub","AI Assistant for your GitHub issues and pull requests. Create entire features and fix bugs on complex GitHub projects at a distance of a text description.","Main: https://www.codeautopilot.com/ | Web: https://www.codeautopilot.com/ | Docs: https://docs.codeautopilot.com/ | X: https://twitter.com/code_autopilot | Gustavo Silva - co-founder of Code Autopilot: https://twitter.com/Gsandec | Fábio Zé Domingues - co-founder of Code Autopilot: https://twitter.com/fjrdomingues"
"Codegen","Coding","Codegen is an agent that allows automatically solve tickets, write tests and level up user's development workflow with the power of GPT-4. Use-case: Coding, debugging, code migration etc. Models used: GPT-4","Main: https://www.codegen.com/ | Web: https://www.codegen.com/ | X : https://twitter.com/Codegen | Founder's X: https://twitter.com/mathemagic1an"
"Codium AI","Coding","Generating meaningful tests for busy devs Exploring and analyzing your code, docstrings, comments, and by interacting with you Non-trivial tests (and trivial, too!) suggested right inside your IDE - Generates tests - Covers edge cases - Best practice, readability code suggestions - Gives you the code explanation It is free","Main: https://www.codium.ai/ | Twitter: https://twitter.com/CodiumAI | LinkedIn: https://www.linkedin.com/company/codiumai | YouTube: https://www.youtube.com/@Codium-AI | Discord: https://discord.com/invite/SgSxuQ65GF | GitHub: https://github.com/Codium-ai"
"Commit","Coding","Comprehensive job search Accurate job recommendations based on your skills, experience, and preferences AI-powered auto-applications","Main: https://commit.dev"
"Cognosys","General purpose, Research","Friendly UI for building AI agents","Main: https://cognosys.ai | Interview: About deployment, evaluation, and testing of agents with Sully Omar, the CEO of Cognosys AI: https://e2b.dev/blog/about-deployment-evaluation-and-testing-of-agents-with-sully-omar-the-ceo-of-cognosys-ai"
"ContextQA","Coding","Agentic AI for Complete Test Coverage","Main: https://contextqa.com/ | Web: https://contextqa.com/ | X (Twitter): https://x.com/ContextQa"
"Cursor","Coding","Cursor is the AI-first Code Editor. Build software faster in an editor designed for pair-programming with AI.","Main: https://www.cursor.so/ | Website: https://www.cursor.so/ | GitHub (Issue Only): https://github.com/getcursor/cursor | Discord: https://discord.com/invite/PJEgRywgRy"
"Cykel","General purpose, Productivity","Cykel is an AI co-pilot model that can interact with any UI, website or API in response to natural language commands Use-case: General purpose, Personal assistant (helping with daily tasks)","Main: https://www.cykel.ai/ | Web: https://www.cykel.ai/ | X : https://twitter.com/CykelAI | LinkedIn: https://www.linkedin.com/company/cykelai | Founder's X: https://twitter.com/EwanCollinge"
"Devin","General purpose, Coding","Devin is in early phase now, but according to demo, it has the following capabilities: Can learn how to use unfamiliar technologies. Can build and deploy apps end to end. Can autonomously find and fix bugs in codebases.","Main: https://www.cognition-labs.com/introducing-devin | Blog post: https://www.cognition-labs.com/introducing-devin | X (Twitter): https://twitter.com/cognition_labs"
"Diagram","Design, Content creation","AI-powered design tools for everything from copywriting to generating unique icons from text Magic Copy writes, edits, and rewrites Figma text layers so you can design with real copy Generating images in Figma while designing Magic Rename intelligently names your layers so you can spend more time designing Magician works right inside your favorite design tool (e.g., Figma) Possible to get all the latest AI design advancements + future spells in one convenient plugin","Main: https://diagram.com/ | Web: https://diagram.com/"
"Docket AI","Sales","Docket AI is your personal AI Sales Engineer, empowers AEs to win more. It provides instant sales answers, automated RFP responses, and insights from top producers. Powered by the Sales Knowledge Lake™, Docket unifies your company’s sales data with genAI. Transforming sales productivity and win rates.","Main: https://docketai.net/ | Web: https://docketai.net/"
"Duckie AI","Coding, Multi-agent","Duckie AI is a platform that lets engineers manage a team of AI software development companions (Ducklings) that get their dev work done Ducklings work with engineers to complete end-to-end feature development, from design to implementation Ducklings chat with users to define their goals, come up with engineering designs, and generate code Founded: 2023 Location: San Francisco","Main: https://duckie.ai/ | Web: https://duckie.ai/ | X : https://twitter.com/duckie_ai | LInkedin: https://www.linkedin.com/company/duckie-ai/about/ | Discord: https://discord.com/invite/JwQSRj9Wx2 | YCombinator profile: https://www.ycombinator.com/companies/duckie-ai"
"Ellipsis","Coding, GitHub, GitLab","Create an Issue Approve the Implementation Plan Review the Pull Request Features - Writing code - Reviewing changes - Addressing comments - Answering questions","Main: https://ellipsis.dev/?utm_source=awesome-ai-agents | Docs: https://docs.ellipsis.dev | Installation: https://www.ellipsis.dev/"
"encode","Coding","Fully autonomous AI SW engineer in early stage","Main: https://encode.software"
"Factory","Coding","In aplha stage It’s not supposed to be just another coding copilots like GitHub Copilot or Codeium, but autonomous agents capable of autonomously building software from end to end","Main: https://www.factory.ai/ | CEO: https://twitter.com/matangrinberg"
"Fine","Coding, Multi-agent, Build-your-own","Deploy, manage, and run AI agents that serve as your virtual teammates. Built for teams, with organizational memory and collaboration in mind. Privacy oriented, we don't store your code, everything runs locally. Multiagent platform: Build your own custom agents.","Main: https://www.fine.dev/ | Twitter: https://twitter.com/thisisfinedev | Discord: https://discord.gg/nxW8sA5yqe | YouTube: https://www.youtube.com/@thisisfinedev"
"Fixie","Build-your-own","Building and managing LLM powered applications A cloud-based platform-as-a-service that allows developers to build smart agents that couple LLMs with back-end logic to interface to data, systems, and tools","Main: https://www.fixie.ai/ | GitHub: https://github.com/fixie-ai | Fixie Developer Portal: https://docs.fixie.ai/ | AI.JSX: https://docs.ai-jsx.com/ | Twitter: https://twitter.com/fixieai | Discord: https://discord.com/invite/MsKAeKF8kU"
"Floode","Productivity","Works across all your communication and work tools: emails, social media DMs, calendar, Notion, etc. Adapted to your work habits. Ask your assistant to: - Craft messages - Auto-sort - Auto-schedule - Summarize, extract tasks and information","Main: https://floodehq.com/ | Twitter: https://twitter.com/floodehq"
"GitHub Copilot X","Coding, GitHub","AI pair programmer Chat and terminal interfaces Support for pull requests Early adoption of OpenAI’s GPT-4","Main: https://github.com/features/preview/copilot-x | Community: https://github.com/orgs/community/discussions/ | Documentation: https://docs.github.com/en | Twitter: https://twitter.com/GitHubCopilot"
"GitLab Duo","Coding","A suite of AI-powered capabilities for #DevSecOps workflows A toolbox of features integrated into the DevSecOps Platform to help teams across the entire software development environment become more efficient Examples of what GitLab Duo can do: - Planning refinement - Security risk resolution - CI/CD pipeline health - Analytics charting.","Main: https://about.gitlab.com/gitlab-duo/ | Twitter: https://twitter.com/gitlab"
"GitWit","Coding","Automate code generation with AI. In beta version","Main: https://www.gitwit.dev/"
"Graphlit","Coding","Built on a serverless, cloud-native platform, Graphlit simplifies complex data workflows, including data ingestion, knowledge extraction, semantic search, alerting and application integrations.","Main: https://www.graphlit.com/ | Web: https://www.graphlit.com/ | GitHub: https://github.com/graphlit | X : https://twitter.com/graphlit | Discord: https://discord.com/invite/WjxCHhV8Cz | Documentation: https://docs.graphlit.dev/getting-started/readme"
"Grit","Coding","Grit uses machine learning and static analysis to auto-generate pull requests for cleaning up technical debt Users can declare how they want their code to be structured and let Grit rewrite it for them","Main: https://www.grit.io/ | Linkedin: https://www.linkedin.com/company/getgrit/0 | Twitter: https://twitter.com/gritdotio"
"Heights Platform","Productivity","Heights AI Chat can make edits to your digital products, answer support questions, and provide advice on growing your business. Heights AI Coach is your personal autonomous coach, helping you accomplish your unique goals - Your AI coach will ask you questions and analyze the products you create to provide you with new tasks and recommendations every week. - Information you share with your AI Coach will never be shared with another creator's AI Coach. - Any information submitted will never be used for AI language model training data.","Main: https://www.heightsplatform.com/ | AI Features: https://www.heightsplatform.com/features/ai | Twitter: https://twitter.com/HeightsPlatform"
"Hex Magic","Coding, Data analysis","""A suite of powerful AI features meant to augment data people"" Hex can explain and document your code Hex Magic features know about database schemas, past operations, and the project’s execution graph, so they can make deeper, more insightful recommendations You can see more – and sign up for the waitlist – over here.","Main: https://hex.tech/product/magic-ai/ | Launch post: https://hex.tech/blog/magic-private-beta/"
"Heymoon.ai","Productivity","Personal assistant for life: to keep you on top of your calendar, tasks and information Currently in a beta version","Main: https://heymoon.ai/ | Web: https://heymoon.ai/"
"iMean.AI","Productivity, Daily life, Build-your-own (agent-builing frameworks and platforms)","iMean is the first public product that automates browser task end to end deterministically. Unlike existing solutions that either stuck at middle steps or output only text instructions, iMean can automate the task for you and get you real results.","Main: https://www.imean.ai/ | Web: https://www.imean.ai/ | X (Twitter): https://twitter.com/iMeanAI | LinkedIn: https://www.linkedin.com/company/imean-ai/ | Co-founder's X(Twitter) 1: https://twitter.com/zyonwu | Co-founder's LinkedIn 1: https://www.linkedin.com/in/zyonwu/ | Co-founder's LinkedIn 2: https://www.linkedin.com/in/yanni-shawn-a6222318b/ | Launch post: https://x.com/zyonwu/status/1747801290368004424?s=20"
"Instrukt","Coding, Build-your-own","Enables users to create and instruct modular AI agents, generate document indexes for question-answering, and attach tools to agents for enhanced functionalities. Facilitates coding assistance and conversational capabilities through predefined agents, along with the option to design custom agents, all within a keyboard and mouse-friendly terminal interface. Provides secure execution environments for agents through Docker containers, allowing for safe and private operations, along with an integrated developer console for debugging and introspection.","Main: https://github.com/blob42/Instrukt | GitHub: https://github.com/blob42/Instrukt"
"Invicta","Build-your-own (agent-builing frameworks and platforms), Multi-agent","Your AI autopilot, not just a co-pilot. In-sync Knowledge Base: Notion, Google Drive, URLs, all file types and more Self-improving: They get better with each interaction and collaboration. LLM Agnostic. Use the best LLMs from OpenAI, Google, Mistral, and Anthropic, etc. Deploy agents where your team is: Zendesk, Slack, Discord, etc. Cooperative AI Teams: your agents can collaborate with each other as a team to complete complex workflows","Main: https://invictai.io/ | Web: https://invictai.io/ | GitHub: https://github.com/Invicta-AI | X (Twitter): https://twitter.com/InvictaAI | LinkedIn: https://www.linkedin.com/company/invicta-ai/"
"Julius","Data analysis","Chat-powered data analytics and AI agents, all in a notebook interface Allows to answer any question about users' data with a single prompt An intelligent data analyst tool that interprets, analyzes, and visualizes complex data in an intuitive, user-friendly manner ""Jupyter Notebooks on steroids""","Main: https://julius.ai/"
"Kadoa","Coding, Data analysis","Using LLMs to generate web scrapers and data processing steps on the fly that adapt to website changes. Features - No coding or browser extension required. - The autonomous crawling agent efficiently locates the desired information on websites. - Adaptability to website changes makes it maintenance-free - Transforms data from multiple sources into the same structure - Handles all clicking and scrolling automatically - Handles proxies - Powerful integrations","Main: https://www.kadoa.com/ | Playground: https://www.kadoa.com/playground"
"Juno","Data analysis, Research, Business intelligence, web UI","Meet Juno! An AI-moderated research platform that conducts research and collects human insights. It’s unsupervised, multilingual and autonomous. Trained by veteran researchers, Juno empowers everyone to conduct in-depth qualitative research, without prior experience. LLMs/model providers supported - OpenAI","Main: https://heyjuno.co/ | Web: https://heyjuno.co/ | X: https://twitter.com/heyjunoco | LinkedIn: https://www.linkedin.com/company/heyjunoco/ | Privacy overview: https://twitter.com/heyjunoco"
"Kompas AI","Productivity, Build-your-own, Business intelligence","Kompas AI is an advanced AI assistant for your team. It's designed to assist and enhance your productivity. It processes multiple tasks simultaneously. Kompas AI outperforms ChatGPT Pro in response speed, using Microsoft Azure's OpenAI Service. Kompas AI offers a free trial that allows you to use the Pro version for 10 days. Kompas AI primarily uses the gpt-4-turbo, gpt-4-vision and gpt-3.5-turbo models, but it also supports other models like Gemini, Claude 2, and open-source models. Notably, Kompas AI features a larger context window, through gpt-4-turbo utilizing a 128K tokens Context Window that allows it to remember up to 512,000 characters of past conversation for more complex tasks. Kompas AI prioritizes data security. Your files are protected with strong encryption, and data in transit is safeguarded. Unused data is regularly removed from the system.","Main: https://kompas.ai/ | Web: https://kompas.ai/ | X: https://twitter.com/Kompas_AI | GitHub: https://github.com/KompasAI | LinkedIn: https://www.linkedin.com/company/kompas-ai/ | Medium: https://medium.com/@Kompas.ai | Docs: https://docs.kompas.ai/docs/kompas-ai-intro/service-introduction"
"Kusho","Coding, Productivity, Debugging","KushoAI instantly generates and runs test suites for your APIs so you can push code effortlessly. Save hours of manual effort by delegating API testing to KushoAI. Unlock crash-free releases starting today. 1. Add a link to your Postman collection to instantly generate exhaustive test suites for each API and save hours of manual effort. 2. Get AI-analysed test results in a single click. 3. Auto-run relevant test suites at any stage of your CI/CD pipeline."" Works on your Postman collections ""At KushoAI, we believe that the job of technology is to empower people. We’re building AI agents trained for specific problems to unlock value at a pace faster than ever before.""","Main: https://kusho.ai/ | Web: https://kusho.ai/ | X: https://twitter.com/kushoai | LinkedIn: https://www.linkedin.com/company/kusho/?originalSubdomain=in | Blog: https://blog.kusho.ai/ | YouTube: https://www.youtube.com/@KushoAI | Sourabh Gawande - cofounder at Kusho: https://www.linkedin.com/in/sourabhgawande/ | Abhishek Saikia - cofounder at Kusho: https://www.linkedin.com/in/abhishek1315/"
"Kwal","Productivity","-","Main: https://www.kwal.ai/ | Web: https://www.kwal.ai/ | X (Twitter): https://x.com/Kwal_AI | LinkedIn: https://www.linkedin.com/company/kwal/about/"
"Lindy","Productivity","Lindy is still in a beta version Features - Lindy triages your email - She learns from your inbox and automatically surfaces the highest-priority emails for you - Automatic conflict handling - Daily briefing - Contract management - Meeting note taking - Summarization","Main: https://www.lindy.ai/"
"Makedraft","Coding, Productivity, Generating apps, Design, Content creation","Makedraft is an AI that generates frontend code based on your instructions. You can then copy the HTML to any project You can generate HTML templates with text prompts or highlight the code you want changed and instruct the AI on what to change Makedraft also generates Javascript, as well as Alpine.js. Vue.js is coming soon Makedraft will be introducing a Showcase for people to see Showcase projects. Makedraft is currently in open beta and is free to use. A Pro plan will be available soon. Users who subscribe to the Pro plan will have have their generated projects set to private by default","Main: https://makedraft.com/ | Web: https://makedraft.com/ | Docs: https://docs.makedraft.com/ | X: https://twitter.com/makedraft | YouTube: https://www.youtube.com/@makedraft | Founder's X: David Ma: https://twitter.com/realdavidma | GitHub: https://github.com/makedraft"
"Manaflow","Productivity, Coding, Workflow automation","Manaflow empowers non-technical teams to automate recurring workflows that require analyzing data, connecting APIs, and taking actions. Using English, you can train Manaflow agents to interface with multiple third-party apps concurrently, host custom-built APIs, conduct customer interviews, build persistent data dashboards, run custom ML models, and execute actions for your business.","Main: https://manaflow.ai/ | Web: https://manaflow.ai/ | X (Twitter): https://x.com/manaflowai | LinkedIn: https://www.linkedin.com/company/manaflow-ai/ | YCombinator: https://www.ycombinator.com/companies/manaflow"
"Mutable AI","Coding","Features - AI Autocomplete - Production Quality Code with One Click - Prompt driven development - Test Generation (coming soon)","Main: https://mutable.ai/ | Discord: https://discord.com/invite/zAwadbmuVk | Twitter: https://twitter.com/mutableai | GitHub: https://github.com/mutableai/"
"Otherside's AI Assistant - Hyperwrite","Productivity, General purpose","Hyperwrite is a chrome app that can take control of your browser and complete high level tasks for you. AI agent that can use a web browser like a human ""Just describe what you want it to do, and it will automatically operate Chrome to achieve your task."" Examples of use cases: Booking flights, ordering food, researching complex topics, managing your email Designed to handle tasks from booking flights to conducting in-depth research, and everything in between. Examples of usage: - Organize Gmail inbox - Booking a flight - Ordering online - Finding hire candidates","Main: https://www.hyperwriteai.com/ | Launch announcement: https://twitter.com/mattshumer_/status/1673730806865358848 | Google Chrome Extension: https://chrome.google.com/webstore/detail/hyperwrite-ai-writing-com/kljjoeapehcmaphfcjkmbhkinoaopdnd | Article: https://venturebeat.com/ai/hyperwrite-unveils-breakthrough-ai-agent-that-can-surf-the-web-like-a-human/"
"Phind","Coding, research","Phind is an AI search engine and pair programmer","Main: https://www.phind.com/ | Web: https://www.phind.com/ | Discord: https://discord.com/invite/S25yW8TebZ | X (Twitter): https://twitter.com/phindsearch"
"Powerdrill AI","Data analysis, Productivity, Research, Marketig, Sales, Finance","Powerdrill is an AI SaaS service centered around personal and enterprise datasets. Designed to unlock the full potential of your data, Powerdrill enables you to use natural language to effortlessly interact with your datasets for tasks ranging from simple Q&As to insightful BI analysis. By breaking down barriers to knowledge acquisition and data analysis, Powerdrill boosts data processing efficiency exponentially.","Main: https://powerdrill.ai/ | Web: https://powerdrill.ai/ | Twitter: https://x.com/powerdrillai | Documentation: https://docs.powerdrill.ai/introduction"
"Promptly","Build-your-own, no-code, web UI","Build tailor-made generative AI agents, applications and chatbots that cater to your users' unique needs. Seamlessly integrate your own data and GPT-powered models without any coding experience. Promptly supports all major model providers, like OpenAI, Cohere, Stability AI, Hugging Face, and more. Easily use these models to build powerful apps. Promptly provides embeddable widgets that you can easily integrate into your website. Use these widgets to build conversational AI applications or to add a chatbot to your website. Import your own data and connect it to LLM models to supercharge your generative AI applications and chatbots. Promptly supports a wide variety of data sources, including Web URLs, Sitemaps, PDFs, Audio, PPTs, Google Drive, Notion imports etc LLMs/model providers supported - OpenAI - Cohere - Stability AI - Hugging Face","Main: https://www.trypromptly.com/ | Web: https://www.trypromptly.com/ | X: https://twitter.com/trypromptly | GitHub: https://github.com/trypromptly | Discord: https://discord.com/invite/3JsEzSXspJ | LinkedIn: https://www.linkedin.com/company/trypromptly/ | YouTube: https://www.youtube.com/@trypromptly"
"Q, ChatGPT for Slack","General purpose, Personal assistant, Business intelligence, Productivity","Q functions like ChatGPT, but within your workspace. Secure and shareable, Q won't store or learn your data. Unlike ChatGPT, Q can read various types of URLs and files on-demand with your input. Ideal for summarizing, evaluating, brainstorming ideas, self-reviewing, Q&A, and more. We also support URLs that require authentication, such as Google Workspace Apps. Itemize your team-specific rules, guidelines, and templates.","Main: https://q-bot.suchica.com/ | Web: https://q-bot.suchica.com/ | GitHub: https://github.com/hiroshinishio | LinkedIn: https://www.linkedin.com/company/suchica/ | X: https://twitter.com/QBotGPT | YouTube: https://www.youtube.com/@q-aibot-2182/videos | Founder's LinkedIn: https://www.linkedin.com/in/hiroshi-nishio-084595216/ | Founder's X: https://twitter.com/hnishio0105"
"Questflow","Build-your-own","Questflow is a marketplace designed for SMBs to connect with autonomous AI workers. Our platform enables digital workers to discover and deploy AI agents for seamless workflow automation. With a no-code editor, we empower digital knowledge providers to create, distribute, and monetize AI workers. Similar to Upwork, Questflow offers a marketplace where users can utilize AI agents to accomplish tasks across various digital workspaces. Creators have the opportunity to transform their specialized knowledge into AI agents, expanding their reach and generating revenue.","Main: https://questflow.ai | Twitter: https://twitter.com/questflow | Telegram: https://t.me/+lAFNg26e5aA5NGNl | Discord: https://twitter.com/questflow"
"Relevance AI","Content creation, Productivity, Research, Build-your-own (agent-builing frameworks and platforms), Marketig, Sales, General purpose, Multi-agent, Supports open-source models","Relevance AI is a fast platform to build and deploy AI apps & agents. It's the home of the AI Workforce. AI Workforce is a digital team you can hire to assist you in completing mundane and repetitive tasks. An AI Workforce consists of Agents equipped with Tools specific to your business operations crafted by domain experts. With Relevance, you will have the home of the AI Workforce with a single platform to create your Tools, equip them to Agents and deploy it to your organisation as a Multi-Agent System (MAS). Relevance supports OpenAI, Anthropic, Cohere, PaLM, and more.","Main: https://relevanceai.com/ | Web: https://relevanceai.com/ | GitHub: https://github.com/RelevanceAI | X (Twitter): https://x.com/RelevanceAI_ | LinkedIn: https://www.linkedin.com/company/relevanceai/ | Jacky Koh - X (Twitter): https://x.com/JackyGKoh | Daniel Vassilev - X (Twitter): https://x.com/thedanvass"
"Second","Coding","Migrate frameworks such as Angular to React, libraries such as Redux to React Context, or languages such as JavaScript to TypeScript Perform major version upgrades on any number of applications, of any size Upgrade frameworks such as Next.js 12 to 13, libraries such as MUI 4 to 5, or languages such as Python 2 to 3 Target users: enterprise codebases Roadmap","Main: https://www.second.dev/ | YCombinator: https://www.ycombinator.com/companies/second | Twitter: https://twitter.com/SecondDevHQ | Linkedin: https://www.linkedin.com/company/secondhq/ | Discord: https://discord.com/invite/ZhYUEjsW3Z"
