"name","category","description","links"
"GeniA","Coding","GeniA is able to work along side you on your production enviroment, executing tasks on your behalf in your dev & cloud environments, AWS/k8s/Argo/GitHub etc. Allows you to enhance the platform by integrating your own tools and APIs. Slack App Bot integration. Supports GPT-3.5 & GPT-4.","Main: https://github.com/genia-dev/GeniA"
"Godmode","General purpose","Godmode is a project inspired by Auto-GPT and BabyAGI, conducting various kinds of tasks via nice UI A web platform inspired by AutoGPT and BabyAGI What it can do: - Order your coffee at Starbucks - Perform market analysis - Find and negotiate a lease Supports GPT-3.5 & GPT-4","Main: https://godmode.space/ | GitHub: https://github.com/FOLLGAD/Godmode-GPT | Discord: https://discord.com/invite/vSzCcDDwz3 | Tweet: https://twitter.com/_Lonis_/status/1646641412182536196"
"GPT Discord","Content creation, Productivity, General purpose, Discord","GPT Discord is a robust, all-in-one GPT interface for Discord. GPT Discord supports everything from multi-modality image understanding, code interpretation, advanced data analysis, Q&A on your own documents, internet-connected chat with Wolfram Alpha and Google access, AI-moderation, image generation with DALL-E, and much more! Featuring code execution and environment manipulation by E2B !image LLMs/model providers supported: - OpenAI models","Main: https://github.com/Kav-K/GPTDiscord | GitHub: https://github.com/Kav-K/GPTDiscord | Kaveen Kumarasinghe - founder of GPT Discord - website: https://kaveenk.com/ | Kaveen Kumarasinghe - founder of GPT Discord - LinkedIn: https://www.linkedin.com/in/kaveenk/"
"GPT Engineer","Coding","GPT Engineer is an AI agent that generates an entire codebase based on a prompt. Model: GPT 4 Specify your project, and the AI agent asks for clarification, and then constructs the entire code base Features - Made to be easy to adapt, extend, and make your agent learn how you want your code to look. It generates an entire codebase based on a prompt - You can specify the ""identity"" of the AI agent by editing the files in the identity folder - Editing the identity and evolving the main prompt is currently how you make the agent remember things between projects - Each step in steps.py will have its communication history with GPT4 stored in the logs folder, and can be rerun with scripts/rerun_edited_message_logs.py","Main: https://gptengineer.app/ | Web: https://gptengineer.app | GitHub: https://github.com/AntonOsika/gpt-engineer | Discord: https://discord.com/invite/8tcDQ89Ej2 | Twitter review by @Attack: https://twitter.com/Attack/status/1671165869064609792"
"GPT Migrate","Coding","GOT Migrate easily migrates your codebase from one framework or language to another. Pick from different LLMs Ability to allow GPT Migration to generate and run unit tests for the new codebase Ability to select source and target language of the migration Ability to customize the agent's workflow (setup -> migrate -> test) GPT Migrate team is working on adding benchmarks for the agent","Main: https://github.com/0xpayne/gpt-migrate | Website: https://gpt-migrate.com/ | Announcement: https://twitter.com/joshpxyne/status/1675254164165910528"
"GPT Pilot","Coding","GPT Pilot is an AI agent that codes the entire app as you oversee the code being written Dev tool that writes scalable apps from scratch while the developer oversees the implementation A research project to see how can GPT-4 be utilized to generate fully working, production-ready, apps The main idea is that AI can write most of the code for an app (maybe 95%) but for the rest 5%, a developer is and will be needed until we get full AGI","Main: https://github.com/Pythagora-io/gpt-pilot | GitHub: https://github.com/Pythagora-io/gpt-pilot | Discord: https://discord.com/invite/HaqXugmxr9"
"GPT Researcher","Research, Science","GPT Researcher is a GPT-based autonomous agent that does online comprehensive research on any given topic Can produce detailed, factual and unbiased research reports Offers customization options for focusing on relevant resources, outlines, and lessons Addresses issues of speed and determinism, offering a more stable performance and increased speed through parallelized agent work, as opposed to synchronous operation Inspired by AutoGPT and the Plan-and-Solve paper The main idea is to run ""planner"" and ""execution"" agents, whereas the planner generates questions to research, and the execution agents seek the most related information based on each generated research question","Main: https://github.com/assafelovic/gpt-researcher | Website: https://tavily.com/ | Discord: https://discord.com/invite/2pFkc83fRq"
"GPT Runner","Research, Science","Conversation with your files which selected by you, no embedding, no vector database! It's also a AI Prompt Storybook. You can use it to manage some AI preset with your team. It support any IDE and language developer. We provide cli to run web and VSCode extension, Jetbrains plugin is coming soon. Private first, all data is local. We support both OpenAI and Anthropic (Claude-2) It support support for multiple languages.","Main: https://github.com/nicepkg/gpt-runner | Website: https://github.com/nicepkg/gpt-runner"
"GPTSwarm","Build-your-own (agent-builing frameworks and platforms), General purpose, Multi-agent","GPTSwarm is a graph-based framework for LLM-based agents, providing two high-level features: - It lets you build LLM-based agents from graphs. - It enables the customized and automatic self-organization of agent swarms with self-improvement capabilities. Various human-designed prompt engineering techniques have been proposed to improve problem solvers based on Large Language Models (LLMs), yielding many disparate code bases. We unify these approaches by describing LLM-based agents as computational graphs. Each node implements a function to process multimodal data or query other LLMs. Each edge describes the information flow between operations and agents. Graphs can be recursively combined into larger composite graphs representing hierarchies of inter-agent collaboration. Our novel automatic graph optimizers (1) refine node-level LLM prompts (node optimization) and (2) improve agent orchestration by changing graph connectivity (edge optimization). Experiments demonstrate that our framework can be used to efficiently develop, integrate, and automatically improve diverse LLM agents.","Main: https://gptswarm.org/ | Web: https://gptswarm.org/ | GitHub: https://github.com/metauto-ai/GPTSwarm | Founder's X (Twitter): https://twitter.com/MingchenZhuge"
"IX","Build your own, Multi-agent","IX is a platform for building, debugging, and deploying collaborative Agents and cognitive workflows. -IX is a LangChain-based agent platform that includes all the tools to build and deploy fleets of agents that collaborate to complete tasks. IX is both an editor and a runtime. The editor is a no-code graph style editor for the design of agents, chains, tools, retrieval functions, and collaborative workflows. Intuitive graph style no-code editor. Horizontally scaling agent worker fleet. Multi-user, multi-agent chat interface. Smart input auto-completes `@mentions` and `{file}` references. Supports Chroma and other vector databases for document search. Supports OpenAI API, Anthropic, PaLM, and LLama based models. Component library is easily extended. Powered by LangChain","Main: https://github.com/kreneskyp/ix | Youtube: https://www.youtube.com/watch?v=hAJ8ectypas&list=PLR8AMvFecu1hyMHFzaehbfFcMcECMafVs | Discord: https://discord.gg/jtrMKxzZZQ | Author's Twitter: https://twitter.com/kreneskyp"
"JARVIS","General purpose","JARVIS is a system to connect LLMs with the ML community. Task Planning: Using ChatGPT to analyze the requests of users to understand their intention, and disassemble them into possible solvable tasks. Model Selection: To solve the planned tasks, ChatGPT selects expert models hosted on Hugging Face based on their descriptions. Task Execution: Invokes and executes each selected model, and returns the results to ChatGPT. Response Generation: Use ChatGPT to integrate the prediction of all models, and generate responses.","Main: https://github.com/microsoft/JARVIS | Paper: https://arxiv.org/abs/2303.17580"
"Langroid","General purpose, Build your own","Multi-agent framework for building LLM apps","Main: https://github.com/langroid/langroid"
"Lemon Agent","Productivity, Coding","Lemon agent is a Plan-Validate-Solve (PVS) Agent for accurate, reliable and reproducable workflow automation A standalone supervised Plan and Solve Agent specialized on performing read and write operations on various tools like GitHub, HubSpot or Airtable _(ACL 2023 Paper ""Plan-and-Solve Prompting: Improving Zero-Shot Chain-of-Thought Reasoning by Large Language Models"")_ Separation of tasks and human-in-the-loop interactions: Lemon Agent is currently holding a Planner Agent and a Solver Agent to keep the agents focussed and increase accuracy. We are planning on adding additional agents real soon. In addition, Lemon Agent will ask for approval at relevant workflow steps to make sure the intended actions are executed. Unlimited configuration options: Lemon Agent gives you unlimited configuration options (see example here) when defining your workflow. For instance, you can tell Lemon Agent to ask for permission before executing a workflow step or to drop a ‍ dad joke every time the model executes a workflow step. UI flexibility: Build any UI on top or engage with Lemon Agent via the built-in CLI. [Soon] Model & framework agnostic operations: Lemon Agent is a standalone agent, but can easily be integrated into frameworks like LangChain and be used with any model. Bonus: Identify weak spots in your agent’s decision-making capabilities and move to a more deterministic behavior by further configuring your Lemon Agent workflows. (.html file that can be run without any additional installation)","Main: https://github.com/felixbrock/lemon-agent | Discord: https://discord.gg/fWU4rDYSxw | Author's Twitter: https://twitter.com/felixbrockm"
"LLM Agents","Coding","A minimalistic library for building agents that leverage large language models to automate tasks through a loop of commands and tool integrations. Executing Python code in a REPL environment. Conducting searches on Google and Hacker News. Iterating through a cycle of Thought, Action, Observation, and New Thought based on the output of integrated tools. Dynamically appending new information to the prompt for informed decision-making by the agent.","Main: https://github.com/mpaepper/llm_agents | GitHub: https://github.com/mpaepper/llm_agents | Blog: https://www.paepper.com/blog/posts/intelligent-agents-guided-by-llms/"
"LLM Stack","Build-your-own, no-code, web UI","LLM Stack is a no-code platform to build LLM Agents, workflows and applications with your data LLMStack supports all major model providers, like OpenAI, Cohere, Stability AI, Hugging Face, and more. Easily use these models to build powerful apps. With LLM Stack, you can build generative AI agents like AI SDRs, Research Analysts, RPA Automations etc., without writing any code. Connect agents to your internal or external tools, search the web or browse the internet with agents. LLMs/model providers supported - OpenAI - Cohere - Stability AI - Hugging Face","Main: https://llmstack.ai/ | Web: https://llmstack.ai/ | GitHub: https://github.com/trypromptly/LLMStack | Blog: https://llmstack.ai/blog"
"Local GPT","Research, Data analysis, General purpose","LocalGPT is an open-source initiative that allows you to converse with your documents without compromising your privacy. Inspired by privateGPT, allows using your own documents as an information source Chat with your documents on your local device using GPT models. No data leaves your device and 100% private With everything running locally, you can be assured that no data ever leaves your computer Dive into the world of secure, local document interactions with LocalGPT Most of the description on readme is inspired by the original privateGPT Model: Vicuna-7B Using InstructorEmbeddings Both Embeddings as well as LLM will run on GPU. It also has CPU support if you do not have a GPU Built with Langchain","Main: https://github.com/PromtEngineer/localGPT | GitHub: https://github.com/PromtEngineer/localGPT | Subreddit: https://www.reddit.com/r/LocalGPT/"
"L2MAC","Multi-agent, Coding, Build your own","L2MAC is a multi-agent generation framework that, a single input prompt can generate an extensive unbounded output, such as an entire codebase or an entire book. L2MAC can create near unbounded outputs that align exactly with the user input prompt over very long generation tasks It achieves strong empirical performance of state-of-the-art generation for large codebase tasks and is in the top 3 for the HumanEval coding global benchmark. As L2MAC can detect invalid code and failing unit tests when generating code and automatically error corrects them. Internally persists a complete file-store memory that enables LLM agents to read files and write to files, creating a large output over many iterations It can be instructed to follow an exact prompt program As it generates the output one part at a time, it enables an LLM with a fixed context token limit to be bypassed The paper, peer-reviewed and recently accepted and published at ICLR 2024, introduces L2MAC.","Main: https://github.com/samholt/l2mac"
"Maige","Coding, Productivity, Debugging, Multi-agent","Maige is a codebase agent that runs when new issues and pull requests come up. Its core features are labelling, assigning, and answering questions. Maige can search the entire codebase, spin up a sandbox to run scripts, and even write basic code.","Main: https://maige.app"
"Magick","Coding, SDK for agents, Build-your-own","Magick is an AIDE for creating, deploying, scaling, and monetizing useful AI agents, and prompt chaining. A full suite, model agnostic AIDE for creating, deploying, scaling, and monetizing useful AI agents, and prompt chaining. Magick allows to build things like BabyAGI within an hour. You can watch the graph executing in real time, watch the thought process as it executes, and understand the flow. ""Visual development of autonomous agents is incoming. We have built Magick specifically for the rapid development of cognitive architecture and scalable event-driven autonomous agents.""","Main: https://www.magickml.com/"
"MemFree","Open Source, AI Search, Build your own","Open Source Hybrid AI Search Engine, Instantly Get Accurate Answers from the Internet, Bookmarks, Notes, and Docs. One-Click Chrome Bookmarks Sync and Index Support multiple traditional search engines as source Self-hosted Super Fast Serverless Vector Database Self-hosted Super Fast Local Embedding and Rerank Service Full Code Open Source One-Click Deployment On Production","Main: https://github.com/memfreeme/memfree"
"MemGPT","Memory management, Data analysis","A system that intelligently manages different memory tiers in LLMs to effectively provide the extended context within the LLM's limited context window. Chat with your data - talk to your local files or SQL database Create perpetual chatbots with self-editing memory","Main: https://github.com/cpacker/MemGPT"
"Mentat","Coding","Mentat is the AI tool that assists you with any coding task, right from your command line. Unlike Copilot, Mentat coordinates edits across multiple locations and files. And unlike ChatGPT, Mentat already has the context of your project - no copy and pasting required!","Main: https://github.com/biobootloader/mentat"
"MetaGPT","Multi-agent, Coding, Build your own","MetaGPT is a multi-agent framework that, given one line requirement, returns PRD, Design, Tasks, or Repo. MetaGPT allows to assign different roles to GPTs to form a collaborative software entity for complex tasks It takes a one line requirement as input and outputs user stories / competitive analysis / requirements / data structures / APIs / documents, etc. Internally, MetaGPT includes product managers / architects / project managers / engineers It provides the entire process of a software company along with carefully orchestrated SOPs. Code = SOP(Team) is the core philosophy The paper about LLM-based multi-agent work spushes forward the idea of autonomous agents collaborating with each other to do more than one can on its own. MetaGPT incorporates efficient human workflows as a meta programming approach into LLM-based multi-agent collaboration","Main: https://github.com/geekan/MetaGPT"
"Mini AGI","General purpose","MiniAGI is a minimal general-purpose autonomous agent based on GPT-3.5 / GPT-4 Can analyze stock prices, perform network security tests, create art, and order pizza MiniAGI is a simple autonomous agent compatible with GPT-3.5-Turbo and GPT-4 It combines a robust prompt with a minimal set of tools, chain-of-thoughts, and short-term memory with summarization Capable of inner monologue and self-criticism","Main: https://github.com/muellerberndt/mini-agi | GitHub: https://github.com/muellerberndt/mini-agi"
"Multiagent Debate","General purpose, Multi-agent","Multiagent Debate is an implementation of the paper ""Improving Factuality and Reasoning in Language Models through Multiagent Debate"". The paper illustrates how we may treat different instances of the same language models as a ""multiagent society"", where individual language model generate and critique the language generations of other instances of the language model The authors find that the final answer generated after such a procedure is both more factually accurate and solves reasoning questions more accurately Illustrating the quantitative difference between multiagent debate and single agent generation on different domains in reasoning and factual validity","Main: https://github.com/composable-models/llm_multiagent_debate | GitHub: https://github.com/composable-models/llm_multiagent_debate | Project page: https://composable-models.github.io/llm_debate/ | Paper: https://arxiv.org/abs/2305.14325"
"Multi GPT","General purpose","An experimental open-source attempt to make GPT-4 fully autonomous Multiple ""expertGPTs"" collaborate to perform a task Each with their own short and long-term memory and the ability to communicate with each other Features - Set a task and watch the experts get to work. - Internet access for searches and information gathering - Long-Term and Short-Term memory management - GPT-4 instances for text generation - Access to popular websites and platforms - File storage and summarization with GPT-3.5","Main: https://github.com/rumpfmax/Multi-GPT | Demo: https://www.loom.com/share/b6bec93065794eb8a47e2109697afa39"
"MutahunterAI","Developer tools, Software security, Multi-agent, General purpose","Use Mutahunter to generate unit tests for your codebase, that specifically target the code vulnerabilities. By targeting the exact weaknesses in the code, we boost developer productivity. Unlike copilots which blindly generates test cases for your code, Mutahunter makes use of our mutation testing engine to generate unit tests that specifically target the vulnerabilities in your code Features - Support all major languages. - We can be used locally or can be integrated into any CI/CD runner as part of your existing workflow - You can use Mutahunter with your own LLM APIs for privacy.","Main: https://github.com/codeintegrity-ai/mutahunter | Documentation: https://github.com/codeintegrity-ai/mutahunter?tab=readme-ov-file#mutahunter | Discord: https://discord.gg/9P5V9qmKJn | GitHub: https://github.com/codeintegrity-ai/mutahunter"
"OpenAGI","General purpose","OpenAGI is an open-source AGI R&D platform that enables agents for both benchmark tasks and open-ended tasks Powered by various language models such as GPT-4, Vicuna, LLaMA, and Flan-T5 Supports multi-modality tool learning and task solving such as text, image, video and audio Supports task decomposition into both linear task-solving plans and non-linear task-solving plans Allows both benchmark task solving and open-ended task solving Provides easy-to-use evaluation protocols to evaluate task-solving ability Provide Reinforcement Learning from Task Feedback (RLTF) to allow continuously self-improving agent","Main: https://github.com/agiresearch/OpenAGI | GitHub: https://github.com/agiresearch/OpenAGI | Paper: https://arxiv.org/abs/2304.04370 | Demo: https://www.youtube.com/watch?v=7RaXPPXi0-Y"
"OpenDevin","Coding, general purpose","The OpenDevin project is born out of a desire to replicate, enhance, and innovate beyond the original Devin model. By engaging the open-source community, we aim to tackle the challenges faced by Code LLMs in practical scenarios, producing works that significantly contribute to the community and pave the way for future advancements.","Main: https://github.com/OpenDevin/OpenDevin | GitHub: https://github.com/OpenDevin/OpenDevin"
"Open Interpreter","Coding","Open Interpreter is an open-source interpreter that lets LLMs run code on your computer to complete tasks Runs locally Can for example summarize PDFs, visualize datasets, control your browser Works from a ChatGPT-like interface in your terminal.","Main: https://openinterpreter.com/ | Web: https://openinterpreter.com/ | GitHub: https://github.com/KillianLucas/open-interpreter | Author's Twitter: https://twitter.com/hellokillian"
"Pezzo","Coding","Pezzo is a development toolkit designed to streamline prompt design, version management, publishing, collaboration, troubleshooting, observability and more ""Whether you are a technical person or a stakeholder, you can use Pezzo effectively. We don't believe that AI prompts should be designed in a developer's code editor. Aside from the technical issues with this approach, it blocks productivity."" Features - Centralized Prompt Management: Manage all AI prompts in one place for maximum visibility and efficiency. - Streamlined Prompt Design, Publishing & Versioning: Create, edit, test and publish prompts with ease. - Observability: Access detailed prompt execution history, stats and metrics (duration, prompt cost, completion cost, etc.) for better insights. - Troubleshooting: Effortlessly resolve issues with your prompts. Time travel to retroactively fine-tune failed prompts and commit the fix instantly. - Cost Transparency: Gain comprehensive cost transparency across all prompts and AI models. - Simplified Integration: Reduce code overhead by 90% by consuming your AI prompts using the Pezzo Client, regardless of the model provider.","Main: https://www.pezzo.ai/ | Documentation: https://docs.pezzo.ai/docs/intro.html | GitHub: https://github.com/pezzolabs/pezzo"
"Private GPT","Research, Data analysis","Private GPT is A tool for private interaction with documents, without a need for internet connection Built with LangChain, GPT4All, LlamaCpp, Chroma and SentenceTransformers A test project to validate the feasibility of a fully private solution for question answering using LLMs and Vector embeddings, not production ready","Main: https://www.privategpt.io/ | GitHub: https://github.com/imartinez/privateGPT"
"PromethAI","Productivity, General purpose","""Personalized AI assistant that decomposes problems, offers solutions, and lets you use Agent actions to automate your flows"" Features - Helps users reach a solution by decomposing their requests into categories with a set of options (cuisine -> European) - Has a dynamic UX/UI that helps avoid prompting - Voice input supported - Provides users with results of their queries and automates actions around them - Remembers your past preferences and uses them to optimize your choices Tech - Powered by Langchain, decomposable async prompts + vector DB + Redis cache - App built with Flutter + Dart - Connected to Zapier NLP","Main: https://github.com/topoteretes/PromethAI-Backend | GitHub: https://github.com/topoteretes/ | Website: https://prometh.ai"
"Self-operating computer","Productivity, Research","Using the same inputs and outputs as a human operator, the model views the screen and decides on a series of mouse and keyboard actions to reach an objective.","Main: https://www.hyperwriteai.com/self-operating-computer | Web: https://www.hyperwriteai.com/self-operating-computer | GitHub: https://github.com/OthersideAI/self-operating-computer"
"Smol developer","Coding","Smol is your own junior developer. Deployed in few seconds via e2b Human-centric, coherent whole program synthesis Your own junior developer Allows to develop, debug, and decompile 200 LOC, half english 100k context can summarize both content and codebases Markdown is the best prompting DSL Copy and paste your errors as prompts Copy and paste curl output as prompts Write CSS animation by describing what u want GPT4 >>> GPT3.5/Anthropic Claude for codegen","Main: https://github.com/smol-ai/developer | Demo: https://www.youtube.com/watch?v=UCo7YeTy-aE | Twitter: https://twitter.com/SmolModels | Meme: https://smol.ai/"
"Stackwise","Tool for agents, Coding","Stackwise is a VS Code extension that writes and imports nodejs functions so that you can write code without context switching The open source function collection Explain what you want a function to do, and AI builds it. Stackwise is a VS Code extension that automatically writes and imports nodejs functions so that you can write code without context switching. No more hunting for documentation to integrate with APIs or back and forth with ChatGPT. Just pure functionality within your code!","Main: https://github.com/stackwiseai/stackwise | GitHub: https://github.com/stackwiseai/stackwise | X: https://twitter.com/stackwiseai | Founder's X - Wayne: https://twitter.com/merwanehamadi | Founder's X - Silen Naihin: https://twitter.com/silennai"
